{"$id":"releaseRequirement.v1","$schema":"https://json-schema.org/draft/2020-12/schema","additionalProperties":false,"properties":{"caseClass":{"enum":["boundary","concurrency","fault","negative","positive"],"maxLength":1024,"type":"string"},"contractRefs":{"items":{"maxLength":256,"type":"string"},"maxItems":65536,"minItems":0,"type":"array","uniqueItems":true},"evidenceRolePolicyID":{"maxLength":128,"type":"string"},"executionSuiteID":{"maxLength":256,"type":"string"},"failurePolicyID":{"maxLength":128,"type":"string"},"fixtureCaseKey":{"maxLength":256,"pattern":"^T-\\d{3}/[a-z0-9]+(?:-[a-z0-9]+)*-l[0-5]$","type":"string"},"fixtureExecutionProfileID":{"enum":["isolatedHost","processHarness","syntheticContract"],"maxLength":1024,"type":"string"},"fixtureMode":{"enum":["none","optional","required"],"maxLength":1024,"type":"string"},"level":{"enum":["L0","L1","L2","L3","L4","L5"],"maxLength":1024,"type":"string"},"requirementID":{"maxLength":256,"pattern":"^T-\\d{3}/[a-z0-9]+(?:-[a-z0-9]+)*-l[0-5]$","type":"string"},"schemaVersion":{"const":1,"type":"integer"},"stageBindingPresetID":{"maxLength":256,"type":"string"},"subjectSetID":{"maxLength":256,"type":"string"},"title":{"maxLength":256,"type":"string"},"verificationID":{"maxLength":5,"pattern":"^T-\\d{3}$","type":"string"}},"required":["caseClass","contractRefs","evidenceRolePolicyID","executionSuiteID","failurePolicyID","fixtureMode","level","requirementID","schemaVersion","stageBindingPresetID","subjectSetID","title","verificationID"],"type":"object","x-pulsephone-maxEncodedBytes":67108864}