{"caseClass":"boundary","contractRefs":["docs/pulsephone-trd/08-delivery-and-verification.md#36"],"evidenceRolePolicyID":"role.current-candidate.v1","executionSuiteID":"suite.t019.developer-support-asset-store.v1","failurePolicyID":"failure.product.v1","fixtureCaseKey":"T-019/catalog-cap-boundaries-matrix-l1","fixtureExecutionProfileID":"syntheticContract","fixtureMode":"required","level":"L1","requirementID":"T-019/catalog-cap-boundaries-matrix-l1","schemaVersion":1,"stageBindingPresetID":"stage-bind.host-public-abf.v1","subjectSetID":"subject.all-matched.v1","title":"Catalog Cap Boundaries Matrix","verificationID":"T-019"}