{"caseClass":"positive","contractRefs":["docs/pulsephone-trd/08-delivery-and-verification.md#36"],"evidenceRolePolicyID":"role.current-candidate.v1","executionSuiteID":"suite.t020.preparation-lifecycle.v1","failurePolicyID":"failure.product.v1","fixtureCaseKey":"T-020/observer-attempt-timeout-l3","fixtureExecutionProfileID":"processHarness","fixtureMode":"required","level":"L3","requirementID":"T-020/observer-attempt-timeout-l3","schemaVersion":1,"stageBindingPresetID":"stage-bind.device-preparation-abf.v1","subjectSetID":"subject.preparation.all.v1","title":"Observer Attempt Timeout","verificationID":"T-020"}