{"caseClass":"positive","contractRefs":["docs/pulsephone-trd/08-delivery-and-verification.md#36"],"evidenceRolePolicyID":"role.current-candidate.v1","executionSuiteID":"suite.t008.permissions-media.v1","failurePolicyID":"failure.capability-feature.v1","fixtureMode":"none","level":"L5","requirementID":"T-008/permission-deny-revoke-regrant-matrix-l5","schemaVersion":1,"stageBindingPresetID":"stage-bind.device-tcc-all-bf.v1","subjectSetID":"subject.permissions.v1","title":"Permission Deny Revoke Regrant Matrix","verificationID":"T-008"}