{"caseClass":"positive","contractRefs":["docs/pulsephone-trd/08-delivery-and-verification.md#36"],"evidenceRolePolicyID":"role.current-candidate.v1","executionSuiteID":"suite.t018.metrics-stability-performance.v1","failurePolicyID":"failure.product.v1","fixtureMode":"none","level":"L5","requirementID":"T-018/stability-stage-run-l5","schemaVersion":1,"stageBindingPresetID":"stage-bind.device-performance-abf.v1","subjectSetID":"subject.performance.v1","title":"Stability Stage Run","verificationID":"T-018"}