{"caseClass":"positive","contractRefs":["docs/pulsephone-trd/08-delivery-and-verification.md#36"],"evidenceRolePolicyID":"role.current-candidate.v1","executionSuiteID":"suite.t011.screenshot-artifact.v1","failurePolicyID":"failure.capability-action.v1","fixtureCaseKey":"T-011/screenshot-atomic-output-format-l3","fixtureExecutionProfileID":"isolatedHost","fixtureMode":"required","level":"L3","requirementID":"T-011/screenshot-atomic-output-format-l3","schemaVersion":1,"stageBindingPresetID":"stage-bind.device-action-bf.v1","subjectSetID":"subject.actions.screenshot.v1","title":"Screenshot Atomic Output Format","verificationID":"T-011"}