{"caseClass":"fault","contractRefs":["docs/pulsephone-trd/08-delivery-and-verification.md#36"],"evidenceRolePolicyID":"role.current-candidate.v1","executionSuiteID":"suite.t001.target-safety.v1","failurePolicyID":"failure.product.v1","fixtureCaseKey":"T-001/reconnect-epoch-target-binding-l4","fixtureExecutionProfileID":"processHarness","fixtureMode":"optional","level":"L4","requirementID":"T-001/reconnect-epoch-target-binding-l4","schemaVersion":1,"stageBindingPresetID":"stage-bind.device-aggregate-bf.v1","subjectSetID":"subject.all-matched.v1","title":"Reconnect Epoch Target Binding","verificationID":"T-001"}