{"caseClass":"positive","contractRefs":["docs/pulsephone-trd/08-delivery-and-verification.md#36"],"evidenceRolePolicyID":"role.current-candidate.v1","executionSuiteID":"suite.t017.release-evidence-gate.v1","failurePolicyID":"failure.product.v1","fixtureCaseKey":"T-017/candidate-contract-policy-scope-binding-l5","fixtureExecutionProfileID":"isolatedHost","fixtureMode":"required","level":"L5","requirementID":"T-017/candidate-contract-policy-scope-binding-l5","schemaVersion":1,"stageBindingPresetID":"stage-bind.host-public-abf.v1","subjectSetID":"subject.all-matched.v1","title":"Candidate Contract Policy Scope Binding","verificationID":"T-017"}