{"caseClass":"concurrency","contractRefs":["docs/pulsephone-trd/08-delivery-and-verification.md#36"],"evidenceRolePolicyID":"role.current-candidate.v1","executionSuiteID":"suite.t019.developer-support-asset-store.v1","failurePolicyID":"failure.product.v1","fixtureCaseKey":"T-019/cross-process-single-flight-l3","fixtureExecutionProfileID":"isolatedHost","fixtureMode":"required","level":"L3","requirementID":"T-019/cross-process-single-flight-l3","schemaVersion":1,"stageBindingPresetID":"stage-bind.host-public-abf.v1","subjectSetID":"subject.all-matched.v1","title":"Cross Process Single Flight","verificationID":"T-019"}