{"caseClass":"fault","contractRefs":["docs/pulsephone-trd/08-delivery-and-verification.md#36"],"evidenceRolePolicyID":"role.current-candidate.v1","executionSuiteID":"suite.t014.gui-live-lifecycle.v1","failurePolicyID":"failure.product.v1","fixtureCaseKey":"T-014/fatal-episode-one-shot-recovery-l3","fixtureExecutionProfileID":"processHarness","fixtureMode":"required","level":"L3","requirementID":"T-014/fatal-episode-one-shot-recovery-l3","schemaVersion":1,"stageBindingPresetID":"stage-bind.device-feature-bf.v1","subjectSetID":"subject.live.v1","title":"Fatal Episode One Shot Recovery","verificationID":"T-014"}