{"caseClass":"fault","contractRefs":["docs/pulsephone-trd/08-delivery-and-verification.md#36"],"evidenceRolePolicyID":"role.current-candidate.v1","executionSuiteID":"suite.t019.developer-support-asset-store.v1","failurePolicyID":"failure.product.v1","fixtureCaseKey":"T-019/canonical-role-publish-fault-l2","fixtureExecutionProfileID":"isolatedHost","fixtureMode":"required","level":"L2","requirementID":"T-019/canonical-role-publish-fault-l2","schemaVersion":1,"stageBindingPresetID":"stage-bind.host-public-abf.v1","subjectSetID":"subject.all-matched.v1","title":"Canonical Role Publish Fault","verificationID":"T-019"}