{"caseClass":"positive","contractRefs":["docs/pulsephone-trd/08-delivery-and-verification.md#36"],"evidenceRolePolicyID":"role.current-candidate.v1","executionSuiteID":"suite.t021.device-route-readiness.v1","failurePolicyID":"failure.capability-preparation.v1","fixtureCaseKey":"T-021/classic-command-scope-l4","fixtureExecutionProfileID":"processHarness","fixtureMode":"optional","level":"L4","requirementID":"T-021/classic-command-scope-l4","schemaVersion":1,"stageBindingPresetID":"stage-bind.device-action-preparation-bf.v1","subjectSetID":"subject.legacy-classic.v1","title":"Classic Command Scope","verificationID":"T-021"}