{"caseClass":"positive","contractRefs":["docs/pulsephone-trd/08-delivery-and-verification.md#36"],"evidenceRolePolicyID":"role.current-candidate.v1","executionSuiteID":"suite.t016.ipc-path-contract.v1","failurePolicyID":"failure.product.v1","fixtureCaseKey":"T-016/canonical-app-path-resolver-valid-l2","fixtureExecutionProfileID":"isolatedHost","fixtureMode":"required","level":"L2","requirementID":"T-016/canonical-app-path-resolver-valid-l2","schemaVersion":1,"stageBindingPresetID":"stage-bind.global-contract-abf.v1","subjectSetID":"subject.none.v1","title":"Canonical App Path Resolver Valid","verificationID":"T-016"}