{"caseClass":"fault","contractRefs":["docs/pulsephone-trd/08-delivery-and-verification.md#36"],"evidenceRolePolicyID":"role.current-candidate.v1","executionSuiteID":"suite.t013.replay-trace.v1","failurePolicyID":"failure.product.v1","fixtureCaseKey":"T-013/replay-trace-footer-cap-finalize-l3","fixtureExecutionProfileID":"isolatedHost","fixtureMode":"required","level":"L3","requirementID":"T-013/replay-trace-footer-cap-finalize-l3","schemaVersion":1,"stageBindingPresetID":"stage-bind.device-action-bf.v1","subjectSetID":"subject.actions.replay-trace.v1","title":"Replay Trace Footer Cap Finalize","verificationID":"T-013"}