{"caseClass":"positive","contractRefs":["docs/pulsephone-trd/08-delivery-and-verification.md#36"],"evidenceRolePolicyID":"role.current-candidate.v1","executionSuiteID":"suite.t018.metrics-stability-performance.v1","failurePolicyID":"failure.product.v1","fixtureCaseKey":"T-018/beta-formal-threshold-identity-l5","fixtureExecutionProfileID":"isolatedHost","fixtureMode":"required","level":"L5","requirementID":"T-018/beta-formal-threshold-identity-l5","schemaVersion":1,"stageBindingPresetID":"stage-bind.device-performance-f.v1","subjectSetID":"subject.performance.v1","title":"Beta Formal Threshold Identity","verificationID":"T-018"}