{"caseClass":"positive","contractRefs":["docs/pulsephone-trd/08-delivery-and-verification.md#36"],"evidenceRolePolicyID":"role.current-candidate.v1","executionSuiteID":"suite.t005.legacy-ios14-16.v1","failurePolicyID":"failure.capability-action.v1","fixtureCaseKey":"T-005/legacy-screenshot-format-conversion-l4","fixtureExecutionProfileID":"processHarness","fixtureMode":"optional","level":"L4","requirementID":"T-005/legacy-screenshot-format-conversion-l4","schemaVersion":1,"stageBindingPresetID":"stage-bind.device-action-bf.v1","subjectSetID":"subject.actions.legacy-screenshot.v1","title":"Legacy Screenshot Format Conversion","verificationID":"T-005"}