{"caseClass":"fault","contractRefs":["docs/pulsephone-trd/08-delivery-and-verification.md#36"],"evidenceRolePolicyID":"role.current-candidate.v1","executionSuiteID":"suite.t010.logging-diagnostics.v1","failurePolicyID":"failure.product.v1","fixtureCaseKey":"T-010/action-log-lifecycle-retention-recovery-l3","fixtureExecutionProfileID":"isolatedHost","fixtureMode":"required","level":"L3","requirementID":"T-010/action-log-lifecycle-retention-recovery-l3","schemaVersion":1,"stageBindingPresetID":"stage-bind.device-action-bf.v1","subjectSetID":"subject.all-matched.v1","title":"Action Log Lifecycle Retention Recovery","verificationID":"T-010"}