{"caseClass":"positive","contractRefs":["docs/pulsephone-trd/08-delivery-and-verification.md#36"],"evidenceRolePolicyID":"role.current-candidate.v1","executionSuiteID":"suite.t006.command-behavior.v1","failurePolicyID":"failure.capability-action.v1","fixtureCaseKey":"T-006/device-command-oracle-matrix-l4","fixtureExecutionProfileID":"processHarness","fixtureMode":"optional","level":"L4","requirementID":"T-006/device-command-oracle-matrix-l4","schemaVersion":1,"stageBindingPresetID":"stage-bind.device-action-abf.v1","subjectSetID":"subject.all-matched.v1","title":"Device Command Oracle Matrix","verificationID":"T-006"}