{"caseClass":"boundary","contractRefs":["docs/pulsephone-trd/08-delivery-and-verification.md#36"],"evidenceRolePolicyID":"role.current-candidate.v1","executionSuiteID":"suite.t006.command-behavior.v1","failurePolicyID":"failure.capability-action.v1","fixtureCaseKey":"T-006/command-parameter-cap-mapping-matrix-l1","fixtureExecutionProfileID":"syntheticContract","fixtureMode":"required","level":"L1","requirementID":"T-006/command-parameter-cap-mapping-matrix-l1","schemaVersion":1,"stageBindingPresetID":"stage-bind.device-action-abf.v1","subjectSetID":"subject.all-matched.v1","title":"Command Parameter Cap Mapping Matrix","verificationID":"T-006"}