{"caseClass":"positive","contractRefs":["docs/pulsephone-trd/08-delivery-and-verification.md#36"],"evidenceRolePolicyID":"role.current-candidate.v1","executionSuiteID":"suite.t004.compatibility-claims.v1","failurePolicyID":"failure.capability-device.v1","fixtureMode":"none","level":"L4","requirementID":"T-004/exact-os-build-claim-evidence-l4","schemaVersion":1,"stageBindingPresetID":"stage-bind.device-aggregate-bf.v1","subjectSetID":"subject.all-matched.v1","title":"Exact Os Build Claim Evidence","verificationID":"T-004"}