{"caseClass":"positive","contractRefs":["docs/pulsephone-trd/08-delivery-and-verification.md#36"],"evidenceRolePolicyID":"role.current-candidate.v1","executionSuiteID":"suite.t002.distribution-bundle.v1","failurePolicyID":"failure.product.v1","fixtureMode":"none","level":"L5","requirementID":"T-002/signed-notarized-stapled-bundle-l5","schemaVersion":1,"stageBindingPresetID":"stage-bind.host-public-bf.v1","subjectSetID":"subject.all-matched.v1","title":"Signed Notarized Stapled Bundle","verificationID":"T-002"}